{
  "name": "transform-testMLTrans6",
  "description":"Read table from silver",
  "typ": {"value":  "datalake"},
  "datalakeTransformation":
  {
    "classification": "featureengine",
    "database": "data_output",
    "table": "test_5",
    "partition": "",
    "mode": {"value":  "overwrite"},
    "stages": [
      {
        "name": "stage table 1",
        "description": "stage 1",
        "typ": {"value":  "table"},
        "stageTable": {
          "name": "data",
          "typ": {"value":  "test"},
          "database": "origin",
          "table": "data"
        }
      },
      {
        "name": "stage fill na",
        "description": "stage 2",
        "typ": {"value":  "filler"},
        "drop": ["cmesano"],
        "distinct": true,
        "stageFiller": {
          "name": "fillna",
          "typ": {"value":  "int"},
          "value": "50"
        }
      }
    ]
  }
}
